skills,interests,marks,career_option
Python, Machine Learning,85, Data Scientist
HTML, CSS;javascript,70,web developer
Java, Problem Solving,78, Software Engineer
TensorFlow, Deep Learning,88, AI Engineer
AWS, Cloud Computing,82, Cloud Engineer
Linux, Network Security,80, Cybersecurity Analyst
Solidity, Blockchain,84, Blockchain Developer
Docker, Automation,76, DevOps Engineer
Figma, Creativity,75, UI/UX Designer
Photoshop, Illustration,72, Graphic Designer
Maya, Animation,79, Animator
Unity, Game Design,83, Game Designer
Excel, Analytics,81, Business Analyst
Finance, Accounting,85, Chartered Accountant
Marketing, SEO,77, Digital Marketer
Communication, Leadership,80, HR Specialist
Biology, Research,90, Doctor
Chemistry, Pharmacology,86, Pharmacist
Biotech, Innovation,88, Biotechnologist
Statistics, Data Visualization,84, Data Analyst
Teaching, Communication,74, Teacher
Law, Public Speaking,79, Lawyer
Psychology, Counseling,82, Psychologist
Robotics, AI,91, Robotics Engineer
Management, Strategy,83, Product Manager
Writing, Creativity,78, Content Strategist
,,,
Python, Data Analysis,84, Data Analyst
R, Statistics,86, Data Scientist
JavaScript, Frontend Design,73, Web Developer
React, UI Development,77, Frontend Engineer
Node.js, Backend Systems,80, Backend Developer
PHP, Web Applications,75, Full Stack Developer
SQL, Database Management,82, Database Administrator
AWS, Cloud Infrastructure,88, Cloud Architect
Azure, DevOps,83, DevOps Engineer
Linux, Network Security,79, Cybersecurity Specialist
TensorFlow, Deep Learning,90, AI Engineer
PyTorch, Neural Networks,87, Machine Learning Engineer
C++, Algorithms,81, Software Developer
C#, Game Development,76, Game Developer
Unity, 3D Modeling,74, Game Designer
Figma, UX Research,72, UX Researcher
Photoshop, Branding,78, Graphic Designer
Illustrator, Creativity,80, Visual Designer
Premiere Pro, Video Editing,85, Video Editor
After Effects, Animation,82, Motion Graphics Artist
Excel, Business Analytics,83, Business Analyst
Power BI, Data Visualization,86, Data Visualization Expert
Finance, Investment,88, Financial Analyst
Accounting, Auditing,84, Chartered Accountant
Marketing, Social Media,79, Digital Marketing Specialist
SEO, Content Strategy,77, SEO Analyst
Communication, Negotiation,81, HR Manager
Leadership, Management,85, Project Manager
Strategy, Planning,87, Product Manager
Public Speaking, Law,80, Corporate Lawyer
Legal Research, Policy,82, Legal Advisor
Psychology, Counseling,84, Psychologist
Education, Mentoring,78, Academic Counselor
Teaching, Pedagogy,75, School Teacher
Research, Innovation,89, Research Scientist
Biology, Genetics,91, Genetic Engineer
Chemistry, Pharmaceuticals,88, Pharmacist
Physics, Robotics,90, Robotics Engineer
AI, Automation,92, AI Researcher
Cloud, Security,85, Cloud Security Engineer
Blockchain, Cryptography,83, Blockchain Developer
IoT, Embedded Systems,86, IoT Engineer
Data Mining, Big Data,88, Big Data Engineer
Statistics, Predictive Modeling,87, Data Scientist
Python, NLP,84, NLP Engineer
Java, Mobile Apps,79, Android Developer
Swift, iOS Design,82, iOS Developer
UI, Accessibility,75, UI Designer
UX, Human Behavior,77, UX Designer
Content Writing, Creativity,80, Content Strategist
,,,
Python; SQL; Tableau, Data Visualization,84, Data Analyst
Java; Spring Boot; MySQL, Backend Development,82, Software Engineer
HTML; CSS; React, Frontend Design,78, Web Developer
Python; TensorFlow; Keras, Deep Learning,90, AI Engineer
AWS; Docker; Kubernetes, Cloud Infrastructure,85, Cloud Architect
Linux; Ethical Hacking; Security, Network Protection,80, Cybersecurity Analyst
Solidity; Blockchain; Smart Contracts, Cryptography,83, Blockchain Developer
Python; Automation; Jenkins, DevOps,79, DevOps Engineer
Figma; UX Research; Wireframing, Creativity,75, UI/UX Designer
Photoshop; Illustrator; Branding, Visual Design,77, Graphic Designer
Maya; Blender; Animation, Creativity,81, Animator
Unity; C#; Game Physics, Game Design,84, Game Developer
Excel; Power BI; Statistics, Business Analytics,86, Business Analyst
Finance; Accounting; Auditing, Taxation,85, Chartered Accountant
Marketing; SEO; Google Ads, Digital Strategy,80, Digital Marketer
Communication; Negotiation; Leadership, People Management,82, HR Manager
Biology; Research; Data Analysis, Innovation,89, Bioinformatics Specialist
Chemistry; Pharmacology; Medicine, Healthcare,91, Pharmacist
Physics; Robotics; AI, Automation,92, Robotics Engineer
Python; NLP; Text Mining, Language Processing,88, NLP Engineer
Java; Android Studio; Firebase, Mobile Development,79, Android Developer
Swift; Xcode; UI Design, App Development,82, iOS Developer
Python; R; Statistics, Predictive Modeling,87, Data Scientist
Cloud; Security; DevOps, Infrastructure,84, Cloud Security Engineer
Blockchain; AI; IoT, Emerging Tech,86, Tech Researcher
Python; Django; REST API, Web Applications,80, Full Stack Developer
C++; Algorithms; Data Structures, Problem Solving,83, Software Developer
Python; Pandas; NumPy, Data Cleaning,85, Data Engineer
Excel; SQL; Visualization, Analytics,82, Business Intelligence Analyst
Python; Flask; API Design, Web Development,78, Backend Developer
HTML; CSS; Bootstrap, UI Design,74, Frontend Developer
Python; ML; Statistics, Predictive Analytics,88, Machine Learning Engineer
JavaScript; Node.js; MongoDB, Web Systems,80, MERN Developer
Python; PySpark; Hadoop, Big Data,90, Big Data Engineer
C; Embedded Systems; IoT, Hardware Design,84, IoT Engineer
Python; AI; Vision, Image Processing,87, Computer Vision Engineer
Finance; Excel; Analytics, Business Strategy,82, Financial Analyst
Marketing; Branding; Communication, Creativity,78, Marketing Manager
Leadership; Strategy; Planning, Management,85, Product Manager
Public Speaking; Law; Policy, Legal Research,80, Corporate Lawyer
Psychology; Counseling; Empathy, Human Behavior,83, Psychologist
Education; Mentoring; Communication, Teaching,76, Academic Counselor
Research; Innovation; Data Analysis, Science,88, Research Scientist
Biology; Genetics; AI, Biotechnology,90, Genetic Engineer
Chemistry; Lab Work; Analysis, Pharmaceuticals,86, Chemist
AI; Automation; Robotics, Innovation,92, AI Researcher
Cloud; DevOps; Security, Infrastructure,84, Cloud Engineer
Python; SQL; Excel, Data Management,81, Database Administrator
Communication; Creativity; Writing, Content Creation,77, Content Strategist
Leadership; Management; Planning, Administration,85, Operations Manager
,,,
Python; SQL; Excel, Data Management,82, Data Analyst
Java; Spring Boot; Hibernate, Backend Systems,84, Software Engineer
HTML; CSS; Angular, Frontend Development,77, Web Developer
Python; Keras; Deep Learning, AI Research,91, AI Engineer
AWS; Terraform; Cloud Security, Infrastructure,86, Cloud Architect
Linux; Cybersecurity; Firewalls, Ethical Hacking,80, Cybersecurity Specialist
Solidity; Ethereum; Smart Contracts, Blockchain Tech,83, Blockchain Developer
Python; Jenkins; CI/CD, Automation,79, DevOps Engineer
Figma; Wireframing; UX Testing, Creativity,75, UX Designer
Photoshop; Branding; Creativity, Visual Arts,78, Graphic Designer
Blender; Animation; 3D Modeling, Creativity,81, Animator
Unity; Game Physics; C#, Game Design,84, Game Developer
Excel; Power BI; SQL, Business Analytics,86, Business Analyst
Finance; Auditing; Taxation, Accounting,85, Chartered Accountant
Marketing; SEO; Content Strategy, Digital Branding,80, Digital Marketer
Communication; Leadership; Negotiation, People Management,82, HR Manager
Biology; Data Analysis; Research, Innovation,89, Bioinformatics Specialist
Chemistry; Medicine; Pharmacology, Healthcare,91, Pharmacist
Physics; AI; Robotics, Automation,92, Robotics Engineer
Python; NLP; Text Mining, Language Processing,88, NLP Engineer
Java; Android Studio; Firebase, Mobile Apps,79, Android Developer
Swift; Xcode; UI Design, App Development,82, iOS Developer
Python; R; Statistics, Predictive Analytics,87, Data Scientist
Cloud; DevOps; Security, Infrastructure,84, Cloud Security Engineer
Blockchain; AI; IoT, Emerging Tech,86, Tech Researcher
Python; Django; REST API, Web Applications,80, Full Stack Developer
C++; Algorithms; Data Structures, Problem Solving,83, Software Developer
Python; Pandas; NumPy, Data Cleaning,85, Data Engineer
Excel; SQL; Visualization, Analytics,82, BI Analyst
Python; Flask; API Design, Web Development,78, Backend Developer
HTML; CSS; Bootstrap, UI Design,74, Frontend Developer
Python; ML; Statistics, Predictive Analytics,88, ML Engineer
JavaScript; Node.js; MongoDB, Web Systems,80, MERN Developer
Python; PySpark; Hadoop, Big Data,90, Big Data Engineer
C; Embedded Systems; IoT, Hardware Design,84, IoT Engineer
Python; AI; Vision, Image Processing,87, Computer Vision Engineer
Finance; Excel; Analytics, Business Strategy,82, Financial Analyst
Marketing; Branding; Communication, Creativity,78, Marketing Manager
Leadership; Strategy; Planning, Management,85, Product Manager
Public Speaking; Law; Policy, Legal Research,80, Corporate Lawyer
Psychology; Counseling; Empathy, Human Behavior,83, Psychologist
Education; Mentoring; Communication, Teaching,76, Academic Counselor
Research; Innovation; Data Analysis, Science,88, Research Scientist
Biology; Genetics; AI, Biotechnology,90, Genetic Engineer
Chemistry; Lab Work; Analysis, Pharmaceuticals,86, Chemist
AI; Automation; Robotics, Innovation,92, AI Researcher
Cloud; DevOps; Security, Infrastructure,84, Cloud Engineer
Python; SQL; Excel, Data Management,81, Database Administrator
Communication; Creativity; Writing, Content Creation,77, Content Strategist
Leadership; Management; Planning, Administration,85, Operations Manager
Python; TensorFlow; NLP, AI Research,89, AI Scientist
JavaScript; Vue.js; CSS, Web Development,78, Frontend Engineer
Python; Scikit-learn; ML, Predictive Modeling,87, ML Engineer
AWS; Azure; Cloud Security, Infrastructure,85, Cloud Engineer
Python; SQL; Power BI, Analytics,82, BI Developer
Java; Kotlin; Android Studio, Mobile Apps,80, Mobile Developer
Python; PyTorch; Deep Learning, AI Research,90, AI Engineer
HTML; CSS; JavaScript, UI Design,76, Web Designer
Python; R; Data Mining, Analytics,88, Data Scientist
Python; Java; MySQL, Backend Development,82, Software Engineer
HTML; CSS; JavaScript; React, Frontend Design,78, Web Developer
Python; TensorFlow; Keras; Pandas, Machine Learning,90, AI Engineer
AWS; Docker; Kubernetes; Terraform, Cloud Infrastructure,85, Cloud Architect
Linux; Ethical Hacking; Firewalls; Security, Cybersecurity,80, Cybersecurity Analyst
Solidity; Blockchain; Smart Contracts; Cryptography, Blockchain Tech,83, Blockchain Developer
Python; Jenkins; Git; Automation, DevOps,79, DevOps Engineer
Figma; UX Research; Wireframing; Prototyping, Creativity,75, UI/UX Designer
Photoshop; Illustrator; Branding; Creativity, Visual Design,78, Graphic Designer
Blender; Maya; Animation; 3D Modeling, Creativity,81, Animator
Unity; C#; Game Physics; AI, Game Development,84, Game Developer
Excel; Power BI; SQL; Tableau, Business Analytics,86, Business Analyst
Finance; Accounting; Auditing; Taxation, Chartered Accountant,85, Chartered Accountant
Marketing; SEO; Google Ads; Content Strategy, Digital Branding,80, Digital Marketer
Communication; Leadership; Negotiation; HR, People Management,82, HR Manager
Biology; Data Analysis; Research; Statistics, Bioinformatics,89, Bioinformatics Specialist
Chemistry; Medicine; Pharmacology; Lab Work, Healthcare,91, Pharmacist
Physics; AI; Robotics; Automation, Robotics,92, Robotics Engineer
Python; NLP; Text Mining; Scikit-learn, Language Processing,88, NLP Engineer
Java; Android Studio; Firebase; Kotlin, Mobile Development,79, Android Developer
Swift; Xcode; UI Design; iOS SDK, App Development,82, iOS Developer
Python; R; Statistics; Predictive Analytics, Data Science,87, Data Scientist
Cloud; DevOps; Security; Infrastructure, Cloud Security,84, Cloud Security Engineer
Blockchain; AI; IoT; Emerging Tech, Tech Research,86, Tech Researcher
Python; Django; REST API; SQL, Web Applications,80, Full Stack Developer
C++; Algorithms; Data Structures; OOP, Software Development,83, Software Developer
Python; Pandas; NumPy; Data Cleaning, Data Engineering,85, Data Engineer
Excel; SQL; Visualization; Analytics, BI Analyst,82, BI Analyst
Python; Flask; API Design; Web Development, Backend Systems,78, Backend Developer
HTML; CSS; Bootstrap; JavaScript, UI Design,74, Frontend Developer
Python; ML; Statistics; Predictive Analytics, ML Engineer,88, ML Engineer
JavaScript; Node.js; MongoDB; Express, MERN Development,80, MERN Developer
Python; PySpark; Hadoop; Big Data, Big Data Engineering,90, Big Data Engineer
C; Embedded Systems; IoT; Hardware Design, IoT Engineering,84, IoT Engineer
Python; AI; Vision; Image Processing, Computer Vision,87, Computer Vision Engineer
Finance; Excel; Analytics; Business Strategy, Financial Analyst,82, Financial Analyst
Marketing; Branding; Communication; Creativity, Marketing Manager,78, Marketing Manager
Leadership; Strategy; Planning; Management, Product Manager,85, Product Manager
Public Speaking; Law; Policy; Legal Research, Corporate Lawyer,80, Corporate Lawyer
Psychology; Counseling; Empathy; Human Behavior, Psychologist,83, Psychologist
Education; Mentoring; Communication; Teaching, Academic Counselor,76, Academic Counselor
Research; Innovation; Data Analysis; Science, Research Scientist,88, Research Scientist
Biology; Genetics; AI; Biotechnology, Genetic Engineer,90, Genetic Engineer
Chemistry; Lab Work; Analysis; Pharmaceuticals, Chemist,86, Chemist
AI; Automation; Robotics; Innovation, AI Researcher,92, AI Researcher
Cloud; DevOps; Security; Infrastructure, Cloud Engineer,84, Cloud Engineer
Python; SQL; Excel; Data Management, Database Administrator,81, Database Administrator
Communication; Creativity; Writing; Content Creation, Content Strategist,77, Content Strategist
Leadership; Management; Planning; Administration, Operations Manager,85, Operations Manager
Python; TensorFlow; NLP; AI Research, AI Scientist,89, AI Scientist
JavaScript; Vue.js; CSS; HTML, Frontend Engineer,78, Frontend Engineer
Python; Scikit-learn; ML; Predictive Modeling, ML Engineer,87, ML Engineer
AWS; Azure; Cloud Security; Infrastructure, Cloud Engineer,85, Cloud Engineer
Python; SQL; Power BI; Analytics, BI Developer,82, BI Developer
Java; Kotlin; Android Studio; Firebase, Mobile Developer,80, Mobile Developer
Python; PyTorch; Deep Learning; AI Research, AI Engineer,90, AI Engineer
HTML; CSS; JavaScript; UI Design, Web Designer,76, Web Designer
Python; R; Data Mining; Analytics, Data Scientist,88, Data Scientist
Python; Java; C++; SQL; Algorithms, Software Engineer,85, Software Engineer
HTML; CSS; JavaScript; React; Node.js, Full Stack Developer,82, Full Stack Developer
Python; TensorFlow; Keras; NLP; Deep Learning, AI Engineer,91, AI Engineer
AWS; Docker; Kubernetes; Terraform; Jenkins, Cloud DevOps Engineer,86, Cloud Engineer
Linux; Security; Ethical Hacking; Firewalls; Cryptography, Cybersecurity Specialist,83, Cybersecurity Analyst
Solidity; Blockchain; Ethereum; Smart Contracts; Cryptography, Blockchain Developer,84, Blockchain Developer
Python; Pandas; NumPy; Scikit-learn; Statistics, Data Scientist,87, Data Scientist
JavaScript; Angular; HTML; CSS; Bootstrap, Frontend Developer,78, Web Developer
Python; Flask; Django; REST API; SQL, Backend Developer,82, Backend Developer
C++; Java; Python; Algorithms; Data Structures, Software Developer,85, Software Engineer
Python; PySpark; Hadoop; Big Data; SQL, Big Data Engineer,90, Big Data Engineer
Python; R; Statistics; Machine Learning; Data Visualization, Data Scientist,88, Data Scientist
Java; Spring Boot; Hibernate; SQL; MySQL, Backend Developer,83, Software Engineer
Python; TensorFlow; Keras; PyTorch; Deep Learning, AI Researcher,92, AI Engineer
AWS; Azure; GCP; Cloud Security; DevOps, Cloud Architect,86, Cloud Engineer
Python; SQL; Excel; Tableau; Power BI, BI Analyst,82, Business Analyst
JavaScript; Node.js; React; MongoDB; Express, MERN Developer,80, Full Stack Developer
Python; NLP; Text Mining; Scikit-learn; Language Processing, NLP Engineer,88, NLP Engineer
Python; AI; Vision; Image Processing; Deep Learning, Computer Vision Engineer,87, AI Engineer
Finance; Accounting; Auditing; Excel; Taxation, Chartered Accountant,85, Chartered Accountant
Marketing; SEO; Google Ads; Branding; Content Strategy, Digital Marketer,80, Marketing Manager
Leadership; Strategy; Planning; Communication; Management, Product Manager,85, Product Manager
Public Speaking; Law; Policy; Legal Research; Advocacy, Lawyer,82, Corporate Lawyer
Psychology; Counseling; Empathy; Human Behavior; Research, Psychologist,83, Psychologist
Education; Mentoring; Communication; Pedagogy; Teaching, Teacher,76, Academic Counselor
Research; Innovation; Data Analysis; Statistics; Science, Research Scientist,88, Scientist
Biology; Genetics; Biotechnology; AI; Research, Genetic Engineer,90, Bioinformatics Specialist
Chemistry; Lab Work; Analysis; Pharmaceuticals; Medicine, Pharmacist,86, Healthcare Specialist
AI; Automation; Robotics; Innovation; Deep Learning, AI Researcher,92, Robotics Engineer
Cloud; DevOps; Security; Infrastructure; Automation, Cloud Engineer,84, Cloud Security Engineer
Python; SQL; Excel; Data Management; Analytics, Database Administrator,81, BI Developer
Communication; Creativity; Writing; Content Creation; Strategy, Content Strategist,77, Marketing Specialist
Leadership; Management; Planning; Administration; Strategy, Operations Manager,85, Project Manager
Python; Java; SQL; Git, Backend Development; Problem Solving,84, Software Engineer
HTML; CSS; JavaScript; React; Bootstrap, Frontend Design; Creativity,78, Web Developer
Python; TensorFlow; Keras; Pandas; NumPy, Machine Learning; AI Research,91, AI Engineer
AWS; Docker; Kubernetes; Terraform; Jenkins, Cloud Infrastructure; Automation,86, Cloud Architect
Linux; Ethical Hacking; Firewalls; Cryptography, Cybersecurity; Network Protection,83, Cybersecurity Analyst
Solidity; Blockchain; Ethereum; Smart Contracts, Blockchain Tech; Research,84, Blockchain Developer
Python; Jenkins; Git; CI/CD; Automation, DevOps; Cloud Systems,79, DevOps Engineer
Figma; UX Research; Wireframing; Prototyping, Creativity; Design Thinking,75, UI/UX Designer
Photoshop; Illustrator; Branding; Creativity; Visual Arts, Graphic Design; Marketing,78, Graphic Designer
Blender; Maya; Animation; 3D Modeling, Creativity; Storytelling,81, Animator
Unity; C#; Game Physics; AI; 3D Modeling, Game Development; Creativity,84, Game Developer
Excel; Power BI; SQL; Tableau; Statistics, Business Analytics; Data Visualization,86, Business Analyst
Finance; Accounting; Auditing; Taxation; Excel, Chartered Accounting; Compliance,85, Chartered Accountant
Marketing; SEO; Google Ads; Content Strategy, Digital Branding; Communication,80, Digital Marketer
Communication; Leadership; Negotiation; HR; Strategy, People Management; Team Building,82, HR Manager
Biology; Data Analysis; Research; Statistics; Genetics, Bioinformatics; Innovation,89, Bioinformatics Specialist
Chemistry; Medicine; Pharmacology; Lab Work, Healthcare; Research,91, Pharmacist
Physics; AI; Robotics; Automation; Engineering, Robotics; Innovation,92, Robotics Engineer
Python; NLP; Text Mining; Scikit-learn; Deep Learning, Language Processing; AI Research,88, NLP Engineer
Java; Android Studio; Firebase; Kotlin; XML, Mobile Development; Creativity,79, Android Developer
Swift; Xcode; UI Design; iOS SDK; App Store, App Development; Creativity,82, iOS Developer
Python; R; Statistics; Predictive Analytics; Visualization, Data Science; Research,87, Data Scientist
Cloud; DevOps; Security; Infrastructure; Automation, Cloud Security; Strategy,84, Cloud Security Engineer
Blockchain; AI; IoT; Emerging Tech; Cryptography, Tech Research; Innovation,86, Tech Researcher
Python; Django; REST API; SQL; Flask, Web Applications; Problem Solving,80, Full Stack Developer
C++; Algorithms; Data Structures; OOP; Java, Software Development; Logic,83, Software Developer
Python; Pandas; NumPy; Data Cleaning; SQL, Data Engineering; Analytics,85, Data Engineer
Excel; SQL; Visualization; Analytics; Power BI, BI Analyst; Reporting,82, BI Analyst
Python; Flask; API Design; Web Development; SQL, Backend Systems; Problem Solving,78, Backend Developer
HTML; CSS; Bootstrap; JavaScript; Angular, UI Design; Creativity,74, Frontend Developer
Python; ML; Statistics; Predictive Analytics; Scikit-learn, ML Engineer; AI Research,88, ML Engineer
JavaScript; Node.js; MongoDB; Express; React, MERN Development; Web Systems,80, MERN Developer
Python; PySpark; Hadoop; Big Data; SQL, Big Data Engineering; Analytics,90, Big Data Engineer
C; Embedded Systems; IoT; Hardware Design; Arduino, IoT Engineering; Innovation,84, IoT Engineer
Python; AI; Vision; Image Processing; Deep Learning, Computer Vision; Research,87, Computer Vision Engineer
Finance; Excel; Analytics; Business Strategy; Investment, Financial Analysis; Planning,82, Financial Analyst
Marketing; Branding; Communication; Creativity; Strategy, Marketing Management; Leadership,78, Marketing Manager
Leadership; Strategy; Planning; Management; Communication, Product Management; Innovation,85, Product Manager
Public Speaking; Law; Policy; Legal Research; Advocacy, Corporate Law; Compliance,80, Corporate Lawyer
Psychology; Counseling; Empathy; Human Behavior; Research, Psychology; Therapy,83, Psychologist
Education; Mentoring; Communication; Pedagogy; Teaching, Academic Counseling; Guidance,76, Academic Counselor
Research; Innovation; Data Analysis; Statistics; Science, Research Scientist; Discovery,88, Research Scientist
Biology; Genetics; Biotechnology; AI; Research, Genetic Engineering; Innovation,90, Genetic Engineer
Chemistry; Lab Work; Analysis; Pharmaceuticals; Medicine, Chemistry; Healthcare,86, Chemist
AI; Automation; Robotics; Innovation; Deep Learning, AI Research; Engineering,92, AI Researcher
Cloud; DevOps; Security; Infrastructure; Automation, Cloud Engineering; Strategy,84, Cloud Engineer
Python; SQL; Excel; Data Management; Analytics, Database Administration; Reporting,81, Database Administrator
Communication; Creativity; Writing; Content Creation; Strategy, Content Strategy; Marketing,77, Content Strategist
Leadership; Management; Planning; Administration; Strategy, Operations Management; Leadership,85, Operations Manager
Python; TensorFlow; NLP; AI Research; Deep Learning, AI Science; Research,89, AI Scientist
JavaScript; Vue.js; CSS; HTML; Bootstrap, Frontend Engineering; Creativity,78, Frontend Engineer
Python; Scikit-learn; ML; Predictive Modeling; Statistics, ML Engineering; Analytics,87, ML Engineer
AWS; Azure; Cloud Security; Infrastructure; DevOps, Cloud Engineering; Strategy,85, Cloud Engineer
Python; SQL; Power BI; Analytics; Excel, BI Development; Reporting,82, BI Developer
Java; Kotlin; Android Studio; Firebase; XML, Mobile Development; Creativity,80, Mobile Developer
Python; PyTorch; Deep Learning; AI Research; TensorFlow, AI Engineering; Research,90, AI Engineer
HTML; CSS; JavaScript; UI Design; React, Web Design; Creativity,76, Web Designer
Python; R; Data Mining; Analytics; Statistics, Data Science; Research,88, Data Scientist
Python; Java; C++; SQL; Algorithms, Software Engineering; Problem Solving,85, Software Engineer
HTML; CSS; JavaScript; React; Node.js, Full Stack Development; Creativity,82, Full Stack Developer
Python; TensorFlow; Keras; NLP; Deep Learning, AI Engineering; Research,91, AI Engineer
AWS; Docker; Kubernetes; Terraform; Jenkins, Cloud DevOps; Automation,86, Cloud Engineer
Linux; Security; Ethical Hacking; Firewalls; Cryptography, Cybersecurity; Research,83, Cybersecurity Analyst
Solidity; Blockchain; Ethereum; Smart Contracts; Cryptography, Blockchain Engineering; Innovation,84, Blockchain Developer
Python; Pandas; NumPy; Scikit-learn; Statistics, Data Science; Analytics,87, Data Scientist
JavaScript; Angular; HTML; CSS; Bootstrap, Frontend Development; Creativity,78, Web Developer
Python; Flask; Django; REST API; SQL, Backend Development; Problem Solving,82, Backend Developer
C++; Java; Python; Algorithms; Data Structures, Software Development; Logic,85, Software Engineer
Python; PySpark; Hadoop; Big Data; SQL, Big Data Engineering; Analytics,90, Big Data Engineer
Python; R; Statistics; Machine Learning; Data Visualization, Data Science; Research,88, Data Scientist
Java; Spring Boot; Hibernate; SQL; MySQL, Backend Development; Problem Solving,83, Software Engineer
Python; TensorFlow; Keras; PyTorch; Deep Learning, AI Research; Innovation,92, AI Engineer
AWS; Azure; GCP; Cloud Security; DevOps, Cloud Architecture; Strategy,86, Cloud Engineer
Python; SQL; Excel; Tableau; Power BI, BI Analysis; Reporting,82, Business Analyst
JavaScript; Node.js; React; MongoDB; Express, Full Stack Development; Web Systems,80, Full Stack Developer
Python; NLP; Text Mining; Scikit-learn; Language Processing, NLP Engineering; Research,88, NLP Engineer
Python; AI; Vision; Image Processing; Deep Learning, Computer Vision; Research,87, AI Engineer
Finance; Accounting; Auditing; Excel; Taxation, Chartered Accounting; Compliance,85, Chartered Accountant
Marketing; SEO; Google Ads; Branding; Content Strategy, Digital Marketing; Strategy,80, Marketing Manager
Leadership; Strategy; Planning; Communication; Management, Product Management; Innovation,85, Product Manager
Public Speaking; Law; Policy; Legal Research; Advocacy, Corporate Law; Compliance,82, Lawyer
Psychology; Counseling; Emp,,,
Python; Java; SQL; Git; C++, Backend Development; Problem Solving; Debugging,84, Software Engineer
HTML; CSS; JavaScript; React; Bootstrap; Angular, Frontend Design; Creativity; UI Development,78, Web Developer
Python; TensorFlow; Keras; Pandas; NumPy; PyTorch, Machine Learning; AI Research; Data Science,91, AI Engineer
AWS; Docker; Kubernetes; Terraform; Jenkins; Azure, Cloud Infrastructure; Automation; DevOps,86, Cloud Architect
